{
  "name": "llm-text-summarizer",
  "version": "1.0.0",
  "intent": "summarize-text",
  "author": "agent",
  "created_at": "2026-02-04T23:00:00.000Z",
  "description": "使用 LLM 对长文本生成摘要，提取关键信息",
  "tags": ["llm", "text", "summarization", "nlp"],
  "dependencies": ["llm"],
  "cost_estimate": 0.05,
  "success_threshold": 0.85,
  "status": "experimental"
}
